business	R﻿oyal Rebranding: Gịnị ga-eme ego, 'stamp' nakwa akwụkọ njem mba Britain?	"D﻿ịka ọ chịchara afọ iri asaa n'ọkwa, Ezenwaanyị Elizabeth abụrụla onye dị mkpa na ndụ ndị mba Briten. A﻿ na-ahụ isi ya n'ego, nakwa ngwa ndị ọzọ mana gịnị ga-eme ugbua? E﻿go igwe niile dị na mba Briten ruru ijeri iri abụo na itoolu nwere isi Ezenwaanyị n'elu ya. N﻿ke ọhụrụ a kachasị mee bụ nke ewepụtara n'afọ 2015 mgbe ọ dị afọ iri asatọ na asatọ. Nke ahụ bụ mgbanwe nke ise emerela kemgbe ọ nọ n'ọkwa. Ụ﻿lọọrụ na-arụpụta ego ahụ bụ 'Royal Mint' ekwubeghi mgbe ha ga-eji bido rụpụtawa ego igwe bu isi Eze Charles III na ya mana o nwereike iwe ọtụtụ afọ n'ihi na usoro mgbanwe ya ga-abụ nwayọ nwayọ. T﻿upu agbanwee ego igwe niile site na Teknuzu n'afọ 1971, a na-ahụkarị ndị Eze dị icheiche n'ego mba Briten. A﻿mabeghi etu ego igwe bu ihu Eze ọhụrụ ga-adị mana otu ego igwe emepụtara iche maka ncheta ọmụmụ ya mgbe ọ gbara afọ iri asaa tupenyere azụ. G﻿ọọmentị binye ya aka, a ga-abipute usoro ego ọhụru n'ụlọorụ Royal Mint nke dị na Llantrisant na Saụt Wales. I﻿hu Ezenwaanyị bụ ihe dị n'ego si ụlọakụ mba Ingland kemgbe afọ 1960. Ha ruru  ijeri anọ na ụma ise ma ruo ijeri paụnds iri asatọ dị ka ọ dị ugbua nke mere na dịka ego igwe, a ga-eji nwayọ gbanwe ya. E﻿go akwụkwọ na ego igwe niile ka kwụ chị m. Ụlọakụ mba Ingland ga-enye ọtụtụ mgbasaozi nakwa oge maọbụrụ na ọ ga-agbanwe. K﻿emgbe afọ 1967, Stamp niile ebiputara na-ebu isi Ezenwaanyị Elizabeth II e si n'akụkụ sere. Ụlọorụ Royal Mail ga-akwụsị ibiputa ndi bu isi Ezenwaanyị Elizabeth II ma bido usoro ibipụta ndị ọhụrụ - mana a ka nwereike ị na-eji ndị ochie ezipu ozi edemede. E﻿ tinyebuola ihe Eze ọhụrụ na Stamp mana Royal Mail amabeghi etu eserese ndị ọhụru ga-esi dị. I﻿he karịrị pasentị iri isii n'igbe ozi edemede niile bụ ntụpọ  EIIR bụ nke Ezenwaanyị Elizabth nke pụtara E - Elizabeth, R - Regina (pụtara Ezenwaanyị). N﻿a mpụta Scotland, igbe ọhụrụ ọbụla ịhụrụ ga-ebu apa Eze ọhụrụ mana ọnụogụgụ ndị ha na-ewepụta pere mpe nke ga-eme ka o tee aka tupu ịhụ nke bu ya. S﻿ite na ngwa nri bụ Ketchup rue na nri ọka na anwụrụ isi ọma, ị nwereike ịhụ njirimara Ezenwaanyị ebe e dere ""By appointment to Her Majesty the Queen"" n'ahụ ngwa ndị ịzụrụ na be gi. N﻿gwa ndị ahụ bụ ndị enyere 'nnabata' maọbụ 'Warrant' nke pụtara na ụlọọrụ ahụ na-ebugakwara ya ezinaụlọ Ezenwaanyị kwa mgbe kwamgbe. Kemgbe afọ otu narị gara aga, onye na-achị, nwunye maọbụ di ha nakwa onye ga-anọchi ha anya na-ewepụta njirimara 'warrant' nke ha nke pụtara na ụlọọrụ 800 nweruru warrant ruru 900 ha ji. O﻿nye na-enye warrant ahụ nwụọ, ụlọọrụ ndị ji ya nwere afọ abụọ iwepụ njirimara onye ahụ na ngwa ha. '﻿Warrant' ndị Charles nyere dịka Ọkparaeze ka ga-adị ugbua ọ buzi eze maka na o so ya n'abụghị echichi ya. A﻿ na-atụ anya na Eze ọhụrụ ga-enye nwa ya bụ Ọkparaeze William ikike iwepụta 'Warrant' nke ya. M﻿ana ọ bụghị sọsọ ego na 'Stamp' ka a ga-eme mgbanwe. A﻿kwụkwo njem niile ewepụtara n'aha Ezenwaanyị ka ga-adị ire maka njem mana edemede dị n'ime ndị ọhụrụ ga-agbanwe buru aha Eze. N﻿dị uweojii na mba Ingland na Wales ga-agbanwe apa ha bu n'okpu ha. N﻿dị ọkaiwu niile amabu dịka counsel Ezenwaanyị ga-aghọrọ counsel Eze ozigbo. N﻿a ngwụcha, abụ njirimara ala ahụ ga-agbanwe kwuo 'God save the King'. N﻿ke a ga-abịa me emechaa mkpọpụta akpọrọ 'Proclamation' n'Obieze St James dị na London."	https://www.bbc.com/igbo/articles/c0j18lznwpeo
entertainment	Chioma Jazmine Okafor: Etu m si mata di m na Tik Tok, anyị agbaa akwụkwọ n'ime ọnwa abụọ - Ada Mr Ibu	"Ọbịbịa soshal midia emeela ka ụwa niile dịzie ka otu obere obodo, maka na mkparịtaụka mmadụ na ibe ya adịwanyela mfe. Ọ dịzi mfe mmadụ ịnọ na Naịjirịa mete enyi onye mba ofesi ha abụọ esi otu ahụ bụrụ nnu na mmanụ. Otu a ka ihu ọma si kpọọ Chioma Jasmine Okafor, bụ ada John Okafor (Mr Ibu), onye e ji ejije Nollywood mara. N'ọnwa Disemba afọ 2021 ka Jasmine Okafor zutere otu nwaokorobịa aha ya bụ David Mounds n'ọgbakọ soshal midia a kpọrọ Tik Tok, o ruo n'ọnwa Febrụwarị afọ 2022, ha abụọ abụrụ di na nwunye. Ihe tụrụ ọtụtụ mmadụ n'anya banyere akụkọ a bụ na David Moundz bụ nwaafọ mba Amerịka, onye na-akpabeghị ụkwụ mbụ na mpaghara Afrịka. Jasmine na di ya bụ David agbaalarị akwụkwọ n'ụlọikpe, ma na-echezi ka ha gbaa nkwụ ma gbakwaa akwụkwọ nke ụlọụka. Na mkparịtaụka ya na BBC Igbo, Jasmine David Mound gwara BBC Igbo ihe mere o ji lụọ nwoke ọ hụrụ na Tik Tok n'ime ọnwa abụọ. ""Ọtụtụ na-ekwu na ọnwa abụọ ezughị iji mata mmadụ nke ọma tupu e kwuwe okwu ọlụlụ, mana ọ bụghị ogologo oge mmadụ abụọ matara onwe ha bụ isiokwu,"" Jasmine kwuru. ""Ihe mere m ji kweta ịlụ David Moundz bụ maka na ọ hụrụ m n'anya nke ukwuu."" ""Ọ na-enye m oge ya, ma mgbe ọ nọ n'ụlọ, ma mgbe ọ nọ n'ọrụ, oge niile mụ na ya na-akpa n'ekwentị."" ""Ya kpatara m ji sị na nwoke a na-enye m oge ya niile kwesịkwara ka m nye ya oge m."" Jasmine kwuru na nna ya bụ Mr Ibu, na ndị ezinụlọ ya niile nabatara David Moundz dịka di ya. ""Ihe ka ha mkpa bụ ịhụ na m na-enwe obi aṅụrị oge niile. Ebe ha ma na nwoke a na-enye m obi ọma, ha kwadoro mụ na ya."" Chioma kwuru na ya anaghị egosi ihu di ya na soshal midia, maka na ọ chọghị ka ihe niile gbasara ya dịrị n'ọba ịntaneetị. Mana ọtụtụ malitere ikwu na o nwereike ịbụ na nwoke ahụ alụbuola nwaanyị mbụ, nke mere o ji ezo ihu ya ezo. ""Alụghị m di mmadụ, maọbụ enyi nwoke mmadụ,"" Chioma kọwara. ""Di m alụbeghị nwaanyị mbụ na ndụ ya."" ""Kama ọ bụ m kpebiri na achọghị m itinye ihu ya na soshal midia."" ""Mana enyela m BBC Igbo ikike ka ha gosi ihu ya n'onyonyo a."" Oge akụkọ a wuru na soshal midia n'ọnwa Febrụwarị 2022, ọtụtụ kwuru na Jasmine na-alụ nwoke a n'ihi ego ya, maọbụ n'ihi na ọ chọrọ inweta akwụkwọ iji gafee mba Amerịka. Ọtụtụ kwukwara na ọgaghị ete aka mmadụ abụọ a ekewaa. Mana Jasmine kwuru na ịhụnanya ya na di ya siri ike nke ukwuu. ""Onweghị ihe ga-adị ka obi mgbawa na ọlụlụ di na nwunye anyị, naanị obi aṅụrị na ihe ọma ka anyị ga na-enwe,"" ka o kwuru. Ndị mere akụkọ a bụ Nnamdi Agbanelo na Chukwunaeme Obiejesi."	https://www.bbc.com/igbo/afirika-61341021
religion	CAN ahọpụtala Daniel Okoh dịka onyeisioche ọhụrụ	"Otu Christian Association of Nigeria ahọpụtala Daniel Okoh dịka onyeisi ọhụrụ otu ahụ. Ọnụ na-ekwuru ha bụ Bayo Oladeji gwara BBC Igbo n'ekwentị na nzụkọ akpọrọ 'The Assembly' kwekọrịtara na nhọpụta Okoh dịka onyeisi ọhụrụ ha. Nke a pụtara na onyeisi ochie ahụ Rev Olasupo Ayokunle ga-enyefe ya ọchịchị n'aka n'emume a ga-eme n'ụbọchị Fraịde. Daniel Chukwudumebi Okoh bụ ụkọchukwu kachasị n'ụlọụka Christ Holy Church a ma dịka ""Nation Builders"" maọbụ Odozi obodo. A mụrụ ya na Kano na Nọvemba 12, afọ 1963. Ọ bụ onye Ndoni dị n'okpuruọchịchị Ogba/Egbema/Ndoni dị na Rivers steeti. Ọ lụrụ Ngozi dịka nwunye ya ma jirikwa ụmụ anọ. Okoh arụọla ọrụ ihe karịrị afọ iri abụọ dịka onye na-ekwuchitere ndị ụka Kraịst n'ọgbakọ okpukpere ndị ọzọ. Ọrụ ahụ ọ na-arụ gụnyere ma na Naịjirịa ma na mba dị icheiche n'ụwa niile. Ụfọdụ ọkwa ọ nọrọla na ya gụnyere: - Onyeisioche ọgbakọ ụlọụka okpukpere Kraịst dị na Afrịka bụ OAIC n'ịchafụ - Onyeisi otu OAIC na Naịjirịa (2005 - 2014) - Osote onyeisi CAN na Naịjirịa (2007 - 2013) - Okoh so na mmadụ isii gọọmentị etiti họpụtara n'ọgbakọ idozi ndọrọndọrọ n'afọ 2005. - Okoh so na ndị isi na-elekọta National Orientation Agency site n'afọ 2009 rue afọ 2011. Cheta na akụkọ fegharịburu n'ụbọchị Wenzde na otu jikọrọ ndị okpukpere Kraịst na Naịjirịa bụ CAN n'ịchafụ ahọpụtala onyeisioche ọhụrụ. Mana mgbe BBC Igbo kpọtụrụ ọnụ na-ekwuru otu ahụ bụ Bayo Oladeji, ọ gwara anyị na o nweghi eziokwu dị na akụkọ ahụ. ""Ọ bụ akụkọ ụgha, ihe mere bụ na ndị mmadụ wepụtara aha Daniel Okoh dịka onye nwereike ịbụ onyeisioche mana anyị emebeghi mkpebi maka ya"" ka o kwuru. O gara n'ihu kwuo na ọ bụ n'ụbọchị Tọzde kpọm kwem ka a ga-akpọpụta onyeisioche ọhụrụ otu ahụ. Onye bụbu onyeisi otu ahụ bụ Reverend Olasupo Ayokunle banyere n'ọkwa ahụ n'afọ 2016. CAN bụ otu jikọrọ ụlọụka niile na-ekpere Kraịst n'ala Naịjirịa. E hibere ya bụ ụlọọrụ n'afọ 1976 mgbe ọ bụ naanị ụka Katọlik, ụka Anglịkan nakwa ụka ukwu ndị ọzọ dịka Baptist na Methodist. Ndị ụka Kraịsti hibere otu a iji kwụsịtụ  njikọ ndọrọndọrọ na okpukpere alakuba na-aga n'ihu oge ahụ. Ha pụtakwara katọọ ma megide nsonye ala Naịjirịa n'ọgbakọ mba ndị okpupere alakuba bụ OIC n'afọ He mechaziri gaa n'ihu nabata obere ụlọụka ndị ọzọ n'ime ogige ha. Ha nwere ngalaba nke ụmụ nwaanyị akpọrọ WOWICAN nke Oyin Mabel Sowoolu bụ onyeisi ha ugbua."	https://www.bbc.com/igbo/articles/ce9jv489jq8o
health	WHO ekwuola na ịrụte ọrụ aka na-edula mmadụ 745,000 mmụọ kwa afọ dịka nchọpụta gosiri	"Ịrụte ọrụ aka na-egbu puku kwuru puku mmadụ kwa afọ, dịka ngalaba ahụike mbaụwa bụ ""World Health Organization"" (WHO) si kwuo. Nchọpụta mbụ a na-eme n'ụwa gbasara ya gosiri na mmadụ 745,000 nwụrụ n'afọ 2016 site n'ọrịa mkpọnwụahụ nakwa ọrịa obi nke ịrụ ọrụ ọtụtụ awa butere. Nchọpụta a gosiri na ihe a kacha emetụta ndị mmadụ bi na mpaghara Ọwụwa-Anyanwụ Eshia nakwa Ndịda-Anyanwụ Pasifik. WHO kwuru na ihe a nwereike ịkawanye njọ n'ihi mkpamkpa coronavirus. Nchọpụta a e mere gosiri na ịrụ ọrụ ihe ruru awa 55 maọbụ karịa n'otu izu butere mmadụ iji pasentị 35 (35%) nwee ike ibute ọrịa mkpọnwụ ahụ, ma jirikwa pasentị 17 (17%) nwee ike ime ka mmadụ si n'ọrịa obi nwụọ. Nke a bụ iji tụnyere ịrụ ọrụ awa 35 ruo 40 n'otu izu. Nchọpụta a nke ngalaba International Labour Organization (ILO) so mee, gosikwara na ihe ruru atọ n'ime anọ bụ mmadụ ole nwụrụ n'ihi ịrụ ọrụ ọtụtụ awa bụ ụmụnwoke katatụrụla ahụ maọbụ ndị merela okenye. Ọtụtụ mgbe, ọnwụ ndị a na-abịa mgbe onye ahụ bitetụrụla ndụ, ụfọdụ oge mgbe ọtụtụ afọ gachara, karịa mgbe onye ahụ rụrụ ọrụ ọtụtụ afọ ahụ. Akụkọ ga-amasị gị... Dịka nchọpụta a agụnyeghi oge mkpamkpa ọrịa coronavirus a, ndị ọrụ WHO kwuru na etu ọtụtụ ndị mmadụ si malite ịrụ ọrụ n'ebe ọbụla ha nọ karịa ịbata n'ụlọọrụ nakwa ndakpọ akụnaụba, nwereike iso n'etu ihe ize ndụ ịrụte ọrụ aka si arị elu. ""Anyị nwere ihe mgbaama gosiri na mgbe mba dị iche iche banyere na mgbachi obodo, awa ole e ji arụ ọrụ ji ihe ruru pasentị iri (10%) rịgoo,"" ka Frank Pega bụ onye ọrụ WHO kwuru. Nchọpụta ahụ kwuru na ịrụ ọrụ ọtụtụ awa so bute ụfọdụ nrịanrịa si n'ịrụ ọrụ, nke mere ya nsogbu ọrịa si n'ọrụ kacha. WHO na-atụ atụmatụ ka ndị isi ụlọọrụ buru nke a n'uche mgbe ha na-enyocha ihe ndị nwereike ibutere ndị na-arụrụ ha ọrụ nsogbu ahụike. Pega kwuru sị na ikwu sị na 'ihe a bụ awa ole onye ga na-arụ' ga-abara ndị ọrụ uru dịka a hụrụ na ọ na-akwalite ntinye uchu n'ọrụ. ""Ọ bụ atụmatụ gosiri amamihe na ebulighi awa ole mmadụ ji arụ ọrụ n'oge akụnaụba ọtụtụ mba dị na nsogbu."""	https://www.bbc.com/igbo/mba-uba-57138135
religion	St Valentine's Day: Akụkọ St Valentine bu akụkọ ifo - Ụkọchukwu Katọlik	"Ụbọchị Valentine bụ ụbọchị eji egosi ịhụnanya ọkachasị n'etiti nwoke na nwaanyị. Ọtụtụ ndị na-eji onyinye maọbụ were ihe na-acha ọcha maọbụ ihe na-acha mme mme echeta ya bụ ụbọchị. Anyị na Chika Okpalike Ụkọchukwu na ọkammụta n'African Traditional Religion' tinyere anyị ọnụ na ya bụ okwu. Chika Okpalike kwuru na akụkọ maka Saint Valentine dịka nkọmịrịkọ na nkọkịrịkọ nke bekee nwereike ịkpọ Myth maọbụ Legend. Nke a pụtara na-enweghị ihe a na-atụzịrị aka were sị maọbụ eziokwu maọbụ asị. Kama o kwuru na a na-anabata ya site n'okwukwe na ọ bụ etu o siri mee. Okpalike kwuru na enwere ọtụtụ akụko maka onye bụ Saint Valentine kama ọ bụ abụọ ka ndị mmadụ kacha akọ. Okpalike gwara anyị na ụfọdụ na-akọ na Saint Valentine bụ nwa okorobịa bụ onye nke Kraịst ejidere ka egbuo n'oge ihe dịka 4th century. Ọ kọwara sị "" kama oge ahụ nwa onye ọchichị bụ Emperor nọ n'ọrịa mana Valentine kpere ekpere were gwọọ nwatakịri ahụ ọrịa ya"". O kwuru na akụkọ ga-kwara n'ihu sị na mgbe Valentine gara ị nara ikpe ọnwụ ya, ọ dere nwatakịrị agbọha ahụ akwụkwọ ozi iji kosi ya na ya hụrụ ya n'anya. Chika Okpalike kọwara na-enwere akụkọ ọzọ bụkwa na-enwere Saint Valentine ọzọ onye ụkọchukwu na-agba ndị agha akwụkwọ oge Rome nọ n'ọchịchị ebe dị ukwu. Okpalike kwuru sị, "" Saint Valentine na-agba ndị agha akwụkwọ na nzuzo n'ihi na gọọmentị Rome akwadoghị ndị agha ha ịgba akwụkwọ oge ahụ"". O kwuru na ọ mere nke a amaka ihunanya ọ na-ahụ n'etiti ndị a. Akụkọ ndị a na ndị ọzọ bụ nkọmịrịkọ na nkọkịrịkọ Mmeme ochie nwereike ị bụ ebe emume valentine siri bido Emume Lupercalia: Okpalike kọwara na nke a abụ mmemme ndị Rome na-eme oge gboo. Okplaike kwuru sị, "" Aha Lupercalia sitere n'okwu latin abụọ nke otu n'ime ya bụ Lupus"". O kwuru na Lupus pụtara nkịta ọhịa nke bụ Wolf n'okwu bekee. Ọ kọwara sị, ""Rome oge gboo na-eche na ọ bụ Lupus a zụlịtere ndị chọpụtara mba Rome aha ha bụ Romulus na Remus"". Kama Okpalike kọwara na nyocha agba ọhụrụ na-egosi na Wolf nereike ị bụ ụkpụrụ ezoro ezo nke bụ Code n'okwu bekee. Ọ sị, ""Lupus a pụtara onye akwụnakwụna n'ụzọ ụkpụrụ zoro ezo bụ code"". O kwuru na ihe nke a pụtara n'akụko Lupus nwereike ị bụ na ọ bụ ndị akwụnakwụna zụlitere mmadụ abụọ a chọtara mba Rome. Okpalike kọwara na Lupercalia bụ mmemme ndị Rome na-eme n'ọnwa Febuwarị iji cheta ihụnanya nkịta ọhịa a gosiri Romulus na Remus ndị ha si chọtara mba ha. Okpalike kwuru sị, ""Ọ na-adanye karị sitye n'ime ụbọchị iri na atọ ruo ụbọchị iri na ise nke Febuwarị"". O kwuru sị, ""Ọ bụ chị ha na-efe maka ọmụmu (Fertility) na chi ha na-efe maka ahụike ha ka ha na-emere mmemme a"". Okpalike kwuru na a na-eji uhie ọcha nke pụtara ị dị ọcha na uhie mmemme  eme emume Lupercalia mgbe ochie. Ndị BBC depụtara na emume Saint Valentine danyere n'oge eji echeta ọmụmụ na ihunanya ma gụnye kwa na ọ bụ kwa oge a na-echeta chi Zeus na Hera. Okpalike kọwara na ""Februa bụ aha ụtali esi n'akpụkpa ewu emepụta"". O kwuru na a ụmu nwoke na-eji ya bụ Februa apịatụ ụmụ nwaanyị ndị na-achọ nwa , Ha na-eche kwa na nwa okoroọbịa were ụtalị metụ nwaanyị n'ahụ na nwaanyị ahụ ga-ahụ ya n'anya. Etu Cupid siri bata emume Valentine Okpalike kọwara na Cupid bụ chi Ịhụnanya ndị Greek. Okpalike kọrọ akụko were sị, ""Cupid hụrụ chi ha ọzọ aha ya bụ Apollos n'anya"". O kwuru na akụkọ na-ekwu na Cupid gbara Apollos ụta n'obi ka ọ were hụ ya n'anya. Nke mere na ọtụtụ kwenyere na ọbara si na obi Apollo pụta gosiri ịhụnanya ọ bụ ya mmere eji uwe na ihe na-acha mmemme eme emume Saitn Valentine. Ọ bụ ya mere iji ahụkarị obi na-acha mme mme maọbụ onye ji ụta agba na ya bu obi. Chika Okpalike kọwara na ọ bụ bụ pope Galacius nke mbụ bụ onye bidoro mmemme Saint Valentine n'afọ 496 AD. ụfọdụ na-ekwu na ọ bụ Pope Gelacius wetara emume Lupercalia were nke Saitn Valentine dochie ya. Kama enweghị kwa ihe a ga-eji kwado na ya bụ ihe bụ eziokwu. Kedụ ụka ndị na-eme emume Saint Valentine. Ndị ụka nke CMS bu Angịkan, ndị orthodox na ndị nke Luther na-eme emume Valentine. Ọ bụ emume ncheta Saint Cyril ma Saint Methodius ka ndị ụka katọlịk na-eme. Na-agbanyeghị na Saint Valentine nọ na Kalenda ndị Saint a na-echeta n'ụbọchị ahụ, ndị ụka katọlika anaghị eme mmemme Saint Valentine n'ụbọchị ahụ. Ọkammụta Okpalike kwuru na ugbụa ị ga-ahụta emume ndị Rome ochie ma hụta kwa emume ndị nke Kraịst n'oge valentine ugbua. Okpalike kwuru ma kwusie ya ike were sị na okpukpere chi nke Kraịst  anaghị akwado ịhụnanya mmekọrịta ma ọ bụghị n'etiti di na nwunye. O kwuru sị, "" Ugbua, ihe a na-eme bụ mmekọrịta ihunanya ma nke ụka kraịst na-akwado bụ mgbe nwoke na nwaanyị lụrụ onwe ha"". Kama onye ụkochukwu Katolịk ọzo nke ngalaba Dominican bụ Felix Udolisa kwuru na emume Valentine bụ emume eji echeta ịhụnanya. Udolisa kọwara sị, ""na-agbanyeghị na ọtụtu na-eji ya echeta ihụnanya nke mmekọrịta ahụ, ọkachasị n'etiti ndị ntoroọbịa. E nwere ike iji oge emume valentine kuziere ndị ntorobia ihe bụ ihunanya"". Ọ kọwara na ndị ntorobia a ga-emecha bụrụ nne ma o bụ nna nke mere na ọ ga-ebido n'oge kuziere ha maka ihunanya."	https://www.bbc.com/igbo/afirika-56033310
sports	Liverpool vs Atletico Madrid: Atletico efopụla Liverpool ka ahịhịa na Champions League	Nke a bụ agba nke abụọ n'asọmpi dị n'etiti Liverpool na Atletico Madrid maka onye ga-etozu ịga n'ihu maka asọmpi Champions League. Ndị Liverpool bu n'obi ịbọgwara mmeri Atletico ji otu ọkpụ goolu merie ha na Madrid n'asọmpi nke mbụ ha. Ọ dị ka nzube ndị Liverpool a ga-emezu dịka Georginio Wijnaldum nyere goolu nke mbụ na nkeji iri anọ na atọ. Liverpool rụrụ ụlọ were biri na'ogige ọnụ postu ndị Atletico n'agba nke abụọ n'asọmpi a. Ndọlị ndọlị ha mịtara mkpụrụ dịka Roberto Firmino ji isi ya kara aka were takaa neetị ndị Atletico na nkeji iri itoolu na anọ. Ndị Liverpool agaghị echefu etu onye na-eche ọnụ poostu ha siri gbanye ndị Atletico bọọlụ n'ụkwụ nke mere ka ha were ohere a nye goolu mbụ ha n'aka Marcos Llorente. Nke a gbara ndị Atletico ume dịka Llorente gara n'ihu nye goolu ọzọ na nkeji otu narị na ise. Ọ bụ Alvaro Morata ji goolu nke atọ techuo Liverpool ihu mgbe ọ fọrọ ọkara ole na ole ka e gbuchie asọmpi a .	https://www.bbc.com/igbo/egwuregwu-51848010
business	Natural Resources: Imo State na ihe akụ ọnatarachi juputara n'ime ya	Imo steeti so na steeti na-emepụta mmanụ agbịdị na Naịjirịa. Ụmị mmanụ agbịdị dị n'Imo steeti karịrị otu narị na iri isii. Ụmị ndị dị n'obodo iri na abụọ na steeti ahụ Mana ọ bụghị naanị mmanụ agbidi bụ ihe akụ ọnatarachi dị na steeti ahụ. Lee ndị ọzọ ebe a dịka nchọpụta ngalaba 'Raw Materials Research & Development Council' si kwuo. Zinc bụ ụdị igwe e si n'ala egwupụta. Chaịna, Peru nakwa Ọstrelia bụ mba ndị e ji mmepụta 'zinc' mara. Ọ na-enye aka na mmepụta ọkụ latrik. A gwakọọ 'zinc' na 'copper', e nweta 'brass'. E nwekwara 'zinc' nke na-edozi ahụ. Ihe ndị ọọ e ji 'zinc' emepụta bụ rọba, mmanụ e ji ete ụlọ (paint), na kemịkalụ ụfọdụ. Na mpaghara ụfọdụ n'Okigwe na Orlu ka e nwere 'zinc' n'uju. Gypsum bụ ụdị nkume e si n'ala egwupụta. Ihe e ji ya arụpụta gụnyere nzu bekee a kpọrọ 'chalk', ọgwụ, nakwa 'Plaster of Paris' (POP). E jikwa ya eme ka ala kawanye mma iji kọọ ihe. Ebe ị ga-ahụ 'Gypsum' bụ n'Okigwe. Otu ihe kacha mkpa e ji 'lead' emepụta bụ 'battery'. 'Battery' bụ ihe na-enye ụgbọala, ọgbatumtum, ekwentị na ihe ndị ọzọ ike. E jikwa lead emepụta igwe na ihe ndị ọzọ. Okigwe na Orlu nwere 'lead' n'uju. Ihe e ji 'limestone' arụpụta buru ibu. Ha gụnyere 'cement', 'ceramics' na ihe ndị ọzọ. 'Limestone' na-aka mfe igwupụta karịa nkume ndị ọzọ. Ebe e nwere ya n'Imo Steeti bụ na mpaghara Ohaji-Egbema na Okigwe. 'Kaolin' bụ ụdị nkume ọcha na-akwọ mụrụmụụ. E ji ya emepụta nke Bekee kpọrọ 'ceramics', werekwa ya arụ ọgwụ na-akwụsị otoro maọbụ afọ ọsịsa. Kaolin dị n'Ehime Mbanọ, Isu nakwa Oru North. Lignite bụ ụdị 'coal'. Mana ọnaghị eji uji nke ukwu dịka 'coal' ndị ọzọ. A naghị ejikarị 'lignite' akwọ ụgbọ oloko (train). Ebe ọ na-aka egbo mkpa bụ na mmepụta ọkụ latrik. 'Lignite' dị n'akụkụ ụfọdụ n'Orlu'. Na mpaghara Ideato South nakwa Isu ka e nwere 'bentonite'. Nke a bụ ụdị aja ụrọ na acha ọcha. Ọ na-enye aka n'igwu ụmị dị icheiche dịka ụmị mmiri nke Bkee kpọrọ 'Borehole'. Ọrụ ya bụ igbochi mmiri ịba ebe achọghị ka ọ baa. Obodo dị icheiche n'Imo Steeti nwere ọtụtụ emume ọdịnala mara mma nke ukwu. Ọ bụrụ na e lebaa emume ndị anya ma mezie ya nke ọma, ọ ga-adọta ndị mmadụ ka ha na-abịa njem nlereanya na steeti ahụ. Bịa tinyekwara oshimiri Ugwuta nke a na-akpọ 'Oguta Lake' na Bekee. Ụdị ihe a bụ ihe na-amasị ndị njem nke ukwu. Imo bụkwa steeti ala ya na-emepụta nri nke ọma. Naanị nkọpụta nri, ma e mezie ya ọfụma, nwere ike inye gọọmentị Imo nnukwu ego. Akụkọ ndị ọzọ ga-amasị gị: Ihe nkiri ga-amasị gị:	https://www.bbc.com/igbo/afirika-50202766
entertainment	"Regina Daniels: ""A maghị m ihe ndị mmadụ ji akọrọ m ọnụ"""	Regina Daniels bụ onye na-eme ihe nkiri Nollywood ama ama ekwuola maka etu imụta nwa si gbanwe ndụ ya. O kwukwara ihe mere ọtụtụ ndị ntoroọbịa Igbo anaghị amụta Igbo n'oge. Gere ihe ndị ọzọ o kwuru ihe mere o ji belata aka n'ịnara agwa ugbua n'ihe nkiri Nollywood ugbua. Ọrụ a si n'aka Nnamdi Agbanelo na Jessica Nwankwo	https://www.bbc.com/igbo/afirika-58220571
business	Ọgba mbọ: Onye ọkaiwu na-ere ọkpa	Loveth Ifunanya Chinyere bụ ọkaiwu na-eme ọfụma ọrụ kọwara ihe mere o ji hapụ ọrụ ya bido ire ọkpa. Ọ gwara BBC Igbo na ọ bụ mgbe onye dọkịta chọpụtara otu ọrịa n'ahụ nwa ya nwoke mere o ji kwụsị ọrụ iji nwee ohere ileta nwa ya anya. Loveth sị na kama ọ ga-anọ na nkịtị na o bidoro na-esi nakwa na-ere ọkpa n'ụzọ pụrụiche nke mere ka amara ọkpa ya na Legọs. Akụkọ ihe ndị ọzọ ọ gabigara dị n'ihe onyonyo a. Ọ ga-akpalite mmụọ gị ma mekwa ka ọkpa ya gụwa gị agụ. Onye mere akụkọ a bụ Chiemela Peter Mgbahuru Akụkọ ndị ga-amasị gị	https://www.bbc.com/igbo/afirika-50514450
