business	CBN Redesign Naira: Enweghị uru ibipụta ego ọhụrụ ga-abara Naijirịa ugbua - Ndị ọkammụta	"Dịka gọọmentị na-akwado ibipụta ego ọhụrụ, ọtụtụ ndị mmadụ na-ekwu ihe dị iche iche maka ya bụ atụmatụ. Ndị ọkaibe n'ihe gbasara akụnụba obodo bụ Katch Ononuju na Bongo Adi gwara BBC Igbo uche ha maka ya bụ okwu ibipụta ego ọhụrụ. B﻿ongo Adi kwuru ka gọọmentị Naijirịa wepụ aka enwe n'ofe. Bongo kwuru sị, ""Ha na-ala obodo a n'ihi, obodo ndị ọzọ akụnụba ha ka nke Naijirịa mma na-akpakọ onwe ha, kama anyị na-achọ ụzọ mmefu"". B﻿ongo jụrụ sị, "" Ọ bụ ego ọhụrụ bụ mkpa Naijirịa. Ndị na-ekwu na ebipụta ego ọhụrụ na ndị zokpuru ego ha ga-ewepụta ya. Ọ pụtara na gọọmentị enweghị ebe edenyere ego ole nọ na Naijirịa"". O﻿ kwuru na ibipụta ego ọhụrụ ọzọ ga-efu kwa Naijirịa ego. B﻿ongo kọwara sị, "" Ndị na-edowe ego na edowe ya na Dọla maọbụ pawụnd, ya bụ atụmatụ agagfhị eme ka ndị dowere ego wepụta ya. N'aka nke ọzọ ka Katch Ononuju kwuru si na ibipụta ego ọhụrụ bụ usoro nrụrụaka. O kwuru sị,"" Ya bụ atụmatụ adịgh﻿ị mma, Naịjirịa enweghị ego, anyị na-ebiri nke anyị na-emefu. Ugbua ọ bụ mgbe e kwesịrị imefu ego ịbipụta ego ọzọ"". Ononujo gara n'ihu kwuo,"" d﻿ịka m sị ahụ ya, anyị ga-ebiri ego ọzọ maka atụmatụ a nke ga-etinye kwu n'ụgwọ Naijirịa ji. Enweghị uru m hụrụ ọ baara akụnụba Naijirịa"". O﻿ kwukwara na ekwesịghị ihiwe iwu na mmadụ niile ga-eweghachi ego ha n'ụbọchị iri atọ na otu nke ọnwa Jenuwarị afọ 2023. Ọ kwuru sị, ""Ọ bụrụ na mba ndị mepere emepe, a ga-eji nwayọ nwayọ mee ya kama etu ha sịrị mee ya ga-ebute egwu, ọ dịghị mma"". Ụ﻿lọakụ etiti nke Naịjirịa ekwuola na ha ga-ebipụta akwụkwọ ego naịra ọhụrụ iji gbanwee ndị nke ochie, malite n'ụbọchị 15 nke ọnwa Disemba 2022. O﻿nyeisi ụlọakụ etiti bụ Godwin Emefiele kwuru nke a oge ọ gwara ndị ntaakụkọ okwu n'ụbọchị Wenezde. A﻿kwụkwọ ego ndị a ga-agbanwe bụ narị naịra abụọ, narị naịra ise na otu puku naịra. B﻿BC Igbo kpọtụụrụ otu onye ọrụ n'ụlọakụ etiti ka ọ kọwaara anyị etu mgbanwe akwụkwọ naịra ndị a nwereike isi metụta ndị nkịtị na Naịjirịa. Lee ihe ọ kọwara: C﻿hetakwa na akwụkwọ ego N200, N500, na N1000 nke ochie agaghịzi enwe isi ma ụbọchị 31 nke ọnwa Jenụwarị 2023 gachaa. O﻿nye ọrụ CBN a na-achọghị ka anyị kpọpụta aha ya kwuru na ịgbanwe akwụkwọ ego nwereike iwe gọọmentị nnukwu ego ugbua, mana n'ọdịnihu, ọ ga-aba nnukwu uru karịa. O﻿tu ọkpụrụkpụ ihe mere gọọmentị ji chọọ ịgbanwe akwụkwọ ego N200, N500 na N1000, bụ maka na ego dị n'aka ndị mmadụ ugbua karịrị ego dị n'ụlkọakụ dị icheiche ugboro atọ. ""﻿Ọnụọgụgụ gosiri na ihe karịrị pasentị 85 ego niile na-agagharị na Naịjirịa ugbua dị n'aka ndị mmadụ,"" Emefiele kwuru. ""﻿Iji kwuo ya nke ọma, na ngwụcha ọnwa Septamba, ụlọakụ etiti chọpụtara na n'ime tarị naịra atọ na ụma (N3.23 trillion) na-agagharị na Naịjiria ugbua, ihe karịrị tarị naịra abụọ (N2.73 trillion) dị n'aka ndị mmadụ nkịtị kama ịdị n'ụlọakụ dịka o si kwesị."" ""N'ọnwa Disemba 2015, ego na-agagharị na Naịjirịa dị otu tarị naịra na ụma (N1.46 trillion), mana ugbua, o ruola tarị naịra abụọ na ụma (N2,23 trillion)."" ""﻿Nke a bụ ihe kwesịrị iche onye ọbụla uche, anyị agaghị ekwe ka ọ dịrị etu a gawa,"" Emefiele kwuru. I﻿he ndị ọzọ: ﻿Emefiela kwuru na dịka usoro mmepụta ego na mba ụwa niile si dị, mba ọbụla kwesịrị ị na-agbanwe ego ha kwa afọ asatọ ọbụla, ""mana Naịjirịa agbanwebeghị akwụkwọ ego ya n'ime afọ iri abụọ gara aga"", Emefiele kwuru."	https://www.bbc.com/igbo/articles/c1ev7kn43ygo
business	Ada Palm Palm oil: Adapalm, ogige ọrụ ubi nwere osisi nkwụ karịrị 640,000	AdaPalm bụ aha ịchafụ nke ezigbo aha ya bụ 'Agricultural Development Authority Palm'. Ọ bụ ogige buru nnukwu ibu ebe a na-emepụta mmanụ nri. Osisi nkwụ a kụrụ n'ogige a karịrị puku narị isii na iri anọ na ụma. Ọ bụrụ na ogige a na-arụ ọrụ etu o kwesịrị, ndịọrụ ya ga-eru ihe karịrị mmadụ puku iri abụọ. Mana kedu etu ọnọdụ AdaPalm dị ugbua? Lee ihe BBC Igbo chọpụtara oge anyị gara ebe ahụ. Ndị mere akụkọ a bụ Ikechukwu Kalu, Nnamdi Agbanelo na Adline Okere.	https://www.bbc.com/igbo/afirika-58405964
sports	Liverpool vs Barcelona: Ngwongwo e jiri mara Barcelona akụwasịala	"Lionel Messi a na-etu 'GOAT' tara ahịhịa ndụ taa dịka Liverpool jiri ha hichaa ala ọgbọegwuregwu Anfield. Divock Origi bu ụzọ dọrie neetị ndị Barcelona na nkeji asaa e ji malite ịgba asọmpi a. Georginio Wijnaldum sochiri ya azụ ma gbanye goolu abụọ n'ime nkeji 54 na 56 n'ọkara nke abụọ. Ka a na-ekwu nke a na-ekwu, Origi azaa aha nna ya, ma tụkwasị ya ọzọ na nkeji 79, iji sị Barcelona ""taa! kpuchie ọnụ!"" Lionel Messi na Luis Suarez bụ ndị Barcelona ji eme ọnụ, gbara elu, gbaa ala, mana otu abụghị n'ezi makana Liverpool jidere ha kechie. Cheta na onye ọbụla che na Barcelona ga-egbu Liverpool egbu ka ha ji goolu atọ merie ha n'ụkwụ nke mbụ. Ọkachasị oge ọ pụtara na Mohammed Salah na Roberto Firminho agaghị eso gbaa ya bụ egwuregwu. Mana Liverpool tụgharịrị lie ha na ndụ n'azụ ụlọ ha, gwa ha ""kparịkwaanụ onwe unu"". N'ikpeazụ, Liverpool ji mkpokota goolu (4-3) merie. Ka ọ dị ugbua, Liverpool awụbanyela n'agba ikpeazụ a ga-agba n'ụbọchị mbụ nke ọnwa Juun. Nke a ga-eme ya afọ abụọ na-eso onwe ha, ha na-agba ikpeazụ asọmpi Champions League."	https://www.bbc.com/igbo/egwuregwu-48179273
religion	Ejike Mbaka: Ka onye e ji n'agbụ nwere onwe ya dịka Joseph	"Ụkọchukwu ụka Katọlik  bụ Father Ejike Mbaka ekpeela ekpere ka Chukwu tọhapụ ngwa ngwa onye ọbụla nọ n'agbụ nakwa na mkpọrọ. N'ozi ọ gbasara n'oge ọ na-eme ekpere 'Adoration ụbọchị taa Wenezde n'Enugwu, Fada Mbaka  kpere ekpere ka amara mee n'isi nwaamadi ahụ dịka o mere n'isi Joseph n'Akwụkwọ Nsọ bụ onye o kwuru siri na mkpọrọ bụrụ eze. Mbaka  akpọghị aha onye ọ na-ekwu maka ya mana ozi ahụ na-abịa  ka ọ gachara otu abalị akụkọ gbara na Gọọmentị Naijiria nwụchirị ma kpụlata Naijiria NNamdi Kanu, onye ndu Ipob maka ebubo ịkpa nkata ikewa Naijiria. Ọ gara n'ihu tie n'oke olu, "" O! ndị iro m achịla m ọchị n'ihi na m ga-ekuli ọzọ."" Mbaka onye dọọ aka na ntị na ndị ndu Naijiria akpachaghị anya mee ihe ha kwesịrị ime na Naijiria nwere ike ịgbasa sịrị, ""Ịta ahụhụ abụrụla omenala na Naijiria."" ""Etu Naijiria si aga ugbua, oge na-abịa mgbe aga akpụrụwa ndị ụkọchukwu."" ""Gọọmentị Etiti kpụrụgodi mmadụ niile, ihe na ebe ka ga na- ebe."" ""Ndị ọchịchị were ego ha kwesiri iji nye ndị mmadụ ọrụ ka ha ji ego egbe."" "" Ndị kwesịrị ịnọ na mkpọrọ bụ ndị na-atụnye mmadụ na mkpọrọ."" Mbaka , onye kwuru na  ya zịcha ozi ya, e nwere ike ịkpọ ya oku ọzọ bịa zara ọnụ ya kwuru sị, ""Ịmaja ndị mmadụ agaghị arụ ọrụ. Nnwuchi agaghị egbo nsogbu. Ọ ka mma na gọọmetị gere ndị mmadụ ntị. Enyela nkịta aha ka i were gbuo ya."" Ọ dọrọ ndị gọvanọ Ọwụwa Anyanwụ aka na ntị sị, ""Ndị Gọvanọ ụnụ erela ụmụ n'ihi nkwa ọchịchị ụnụ amaghị ma ọ ga-enwe isi."" Cheta na Mbaka ekpeburola Nnamdi Kanu ekpere  ngozi n'oge ọgbakọ ekpere ""Adoration"" ihe dịka izuụka isii gara aga. Ụka Katọlik mechara  kwsịburu ọrụ dịka onye ndu ọgbakọ ekpere 'Adoration' abalị 30 'iji nye ya ohere ka ọ mee ntụghari uche na ekpere. Mana oge ndị na-eso ahụghị ya n'ọgbakọ ekepere izu ahụ, ha mere ngagharịiwe ma mebie ọtụtụ ihe n'ụlọụka 'Holy Ghost nakwa ụlọ Bishop Enugwu Katọlik bụ Calistus Onaga."	https://www.bbc.com/igbo/afirika-57673398
politics	Attacks on Inec Offices: 'Ọ﻿ bụghị ihe ọma nye ndị Igbo na-ana agba ụlọọrụ Inec ọkụ'	"N﻿dị ọnụ na-eru n'okwu n'Ọwụwa Anyanwụ ekwuola na ọ bụghị uru nye ndị Ọwụwa Anyanwụ na a na-agba ụlọọrụ ngalaba na-ahazị ntuliaka Naijiria bụ Inec n'ịchafụ ọkụ aghar aghara na mpaghara ahụ. H﻿a kwuru na ọ bụghị naanị na ọ ga-emegide ọchịchị onyekwuoucheya,  na ọ ga-anapụ mpaghara ahụ ohere iso kwuo onye ga-abanye n'ọkwa Onyeisiala n'afọ 2023 ọbụladị dịka nwa afọ mpaghara hụ so na ndị nwere ohere irite ọkwa ahụ. Nkwupụta na-abịa dịka ndị omekome sunyechara ọkụ n'ụlọọrụ Inec dị n'okpuru Ọchịchị Oru-West dị n'Imo steeti mebie oche na akọrọngwa ọrụ Inec ndị ọzọ O﻿ru-West, ỤbọchịỤka, abalị anọ nke ọnwa Disemba afọ 2022(4/12/2022.) N'ozi ha wepụtara, Inec kwuru na ya bụ mwakpoo a wakporo ụlọrụ ha n'Oru west ga-eme ya nke asaa a na-awakpo ụlọrụ ha dị na steeti ise dị na Naijiria n'ime ọnwa anọ. Ụfọdụ ndị ọrụ na-eru n'okwu na-arụtụ aka na ọ bụ ndị si wụị̀a Anyanwụ na-etinye aja na garị n'ohere ndị Igbo nwere iji vootu ha kwado nhọpụta onye si mpaghara ha dịka onyeisiala. H﻿a kwuru na o nweghị ka isunye ụlọọrụ Inec ọkụ ga-esi eme ka a ghara ime ntulikaa 2023 dịka ha kwuru ụfọdụ ndị na-eme mkpamkpa ahụ na-eche. Kama, dịka ha siri kwuo,  ọ ga-anapụ ndị Ọwụwa Anyanwu ọnụọgụgụ vootu gbalitere elu iso kwuo onye n'ime  mmadụ anọ kachasị welite isi na-azọ ọkwa Onyeisiala na 2023 onye ga-abanye n'ọkwa ahụ. N﻿onso Orakwe bụ onye ndu otu ""Catch Them Young Initiative, kwuru na ụfọdụ ndị na-eme tigbuo ahụ na-eche na ha nwere ike isi n'ụzọ ahụ gbochinwuo ntuliaka 2023. ""Ọ bụghị ihe dị mma nye ndị Igbo na ụdị ihe a na-eme,ọ bụghị ihe ziri ezi."" ""Ọ bụ ihe mgbagwoju anya na n' oge a, na anyị amaghị ihe anyị na-eme."" "" Ụfọdụ na-eche na ha mee nke a, na a gaghị enwe ntuliaka ọbụla."" ""Ọ bụghị ihe ọma nyere ndị Igbo."" ""Mana ọ kwuru na ụfọdụ aghọtaghị ihe onyekwuuche ya pụtara."" Ọ﻿ bụ imebicha PVC ,gba ya ọkụ, ọ bụ etu ahụ ka ihe ga-eji ka mma? Ọ﻿ ka mma na onye ọbụla gara were PVC ga kwuo onye ọ chọrọ ka ọ chịa."" Orakwe kwuru  na o cheghị na ọ bụ ndị si ebe ọzọ batara n'ala Igbo na-emebi ụlọrụ Inec na akọrọngwa ntuliaka. ""Ị﻿ gaghị asị na ọ bụ onye ọzọ batara,ọ﻿ bụ ndị be anyị na-emekwa onwe anyị."" E wezụga ịgba ụlọọrụ Inec ọkụ, i nwetacha ụfọdụ okwu a na-ekwu na soshal midia, megide ntuliaka ahụ,  ị mara na ihe na-eme anyị si anyị n'aka. ""ihe na-eme anyị si anyị n'aka, Ọ﻿ bụ oke  nọ n'ụlọ gwara oke nọ n'ọhịa na-azụ dị na ngịga."" Orakwe rụturu aka na ihe so bute isu ụlọọrụ Inec ọkụ bụ ""etu obodo si mebie."" Ekemezie bụ onye ọzọ ọnụ na-eru n’okwu kwuru na ụta dịrị Inec nakwa ndị ọrụ nchekwa maka mwakpoo nile na-eme  n'ụlọrụ Inec. OỌ k;pọrọ oku ka Inec ghara iji maka ọdachi ndị a mere gba ọnyụpa n'ihu na e wepụtara PVC ọhụụ were dochie ndị mebiri tupu ntuliaka 2023. N’uche ya, Inec zuru ka e mee n’ihe gbasara nchekwa ngwa ọrụ ha nakwa ịdoghachi ndị lara n’iyi na mwakpo awakporo ụfọdụ ụlọọrụ ha. \nMana n’aka ọzọ ọ tara ndị ọrụ nchekwa ụta ma na-ajụ ihe mere ha ejighi enye Inec nkwado kwesiri n’ụzọ nchekwa. \nỌ jụrụ sị, “Isi ụlọọrụ Inec na-adịkarị nso n’ụlọọrụ ndị uweojii, kedụzia ihe mere na ndị uweojii anaghị enyocha ka ihe ndị a si eme ma na-agba mbọ ịnwụchi ndị aka ha dị namwakpo a?” Ọ﻿ bụghị naanị n'Ọwụwa-Anyanwụ ka a wakporola ụlọọrụ Inec na nsonso a, dịka n'abalị 10 nke ọnwa Novemba afọ 2022,  a wakporo ụlọọrụ ha na Ogun nakwa Osun steeti bụ ebe a gbara ụlọọrụ Inec dị n' Abeokuta, Ogun State nakwa Ede-South, Osun Steeti. M﻿ana mwakpo e merela n'Ọwụwa Anyanwụ kachasị karịa mpaghara ndị ọzọ. Kemgbe ọnwa Mee afọ 2022 bụ mgbe Peter Obi  ghọrọ onye ga-azọrọ ndị 'Labour Party' ọkwa onyeisiala n'afọ 2023 dịka ọ hapụchara otu PDP. Kama ịdajụrụ kemgbe Obi pụtara,  mwakpoo ụlọọrụ ndị Inec nke chaliri n'ọnwa Jenụwarị afọ 2021, malitere rịwa elu. L﻿ee ụfọdụ ebe ndị ọ kọtụọrọla n'Ọwụwa Anayanwụ:  N'ụbọchị Tọzde, abalị mbụ nke ọnwa Disemba, 2022, ndị omekome wakporo ụlọọrụ Inec n' Ọlụ dị n'otu Imo steeti ahụ. N﻿'abalị 27 nke Ọnwa Novemba afọ 2022, ndị omekome wakporo ụlọọrụ Inec na Izzi dị n'Ebonyi steeti sunye ya ọkụ. O﻿kụ ahụ gbara igbe  vootu (ballot bọx) dị 340,igwe na-enye ọkụ latrik 14 nakwa akwụkwọ atụmvootu a mabeghị ọnụ ọgụgụ ya. Ndị omekome wakporo ụlọọrụ Inec dị   n'Okpuru Ọchịchị Igboeze-North dị n'Enugwu steeti n'ọnwa Julai, gbaa ụlọọrụ ahụ ọkụ ma mebie akọrọngwa ọrụ ntuliaka dịka igbe vootu, mkpukpu a na-anọ atụ vootu nakwa oche na tabulu ụlọọrụ ahụ. Ndị omekome wakporo ma sunye ụlọọrụ Inec n'Okpuru Ọchịchị Eze Ezza-North nakwa nke ndị n'oOkpuru Ọchịchị Izzi ọkụ n'ụbọchị Tuzde,abalị 18 nke ọnwa Mee, afọ 2022. Oku ahụ mebiri igwe na-enye ọkụ, igbe e ji atụ vootu na akọrọngwa ntuliaka ndị ọzọ n'ebe ndị a."	https://www.bbc.com/igbo/articles/cd10z52k1v8o
entertainment	Salman Rushdie: Gịnị dị n'ime akwụkwọ o dere na-ese okwu?	"Salman Rushdie, onye dere akwụkwọ ‘Satanic Verses’ nke nọbụ n’ọnọdụ ọ-dị-ndụ-ọnwụ-ka-mma ekwuwela okwu, ebe  dịka ndị dọkịta wepụrụla  igwe e ji eku ume  akwụnyere ya kemgbe a wakporo ya ụbọchị Fraide.. Nwoke a kpọrọ Hadi Matar Rushie ebe ọkwụ  na-ekwu okwu n’ọgbakọ  ndị edemede e mere na New York dị n’ Amerika, sụkaziri  n'afọ nakwa n'obi tupu ndị nọ nso na ndị ọrụ nchekwa egbobido  ya. N'ụbọchị Satode, ndị nọ ya nso kwuru na o merụụ nnukwu ahụ nke bụ na o nwere ike ọ gaghịkwa eji otu anya ya ahụ ụzọ ọzọ. Rushdie bu na-ede akwụkwọ a ma ama  edeela ọtụtụ akwụkwọ gụnyere ""Grimus"", ""Shame"", 'Midnight's Children bụ nke ritere ya nturuugo nwere agba bụ ""Booker Prize"" nn'afọ 1981. Satanic Verses bụ akụkọ ifo banyere ndị ụka Alakụba abụọ bi n' Ingland. Otu n'ime ihe na-ewe ndị okpukperechi Alakuba iwe n'akwụkwọ Satanic Verses bụ na  Rushdie nyere akwụkụna abụọ nọ n'ime akwụkwọ ahụ aha nwunye Mohammadu abụọ. Aha akwụwkọ ahụ sikwa na  ama okwu abụọ e kwuru na Mohammed wepụrụ n'akwụkwọ  Nso Koran bụ nke Mohammerd kwenyere si n'aka ekwensu. Mana Rushdie kpara agụ nọ n'ụra aka n'ọdụ n'afọ 1988 oge o bipụtara akwụkwọ nke ọ kpọrọ, 'Satanic Verses,"" bụ akwụkwọ o . Akwụkwọ ahụ wuru ewu na ụwa ma kpasuo ndị ụka Alakuba na mba ụwa iwe dịka ha hụtara akwụkwọ ahụ dịka mkparị nye  okpukprechi chi ha na onye  Amụma ha bụ Mohammed. Ọtụtụ ha mere ngagharịiwe maka ya  ma mebie ihe. E gburu mmadụ 12 na obodo ya bụ Mumbai, tụọ ụlọnnochite anya mba Briten dị na Tehran okwute. Iwe mere ka onyeisiala mba Iran oge ahụ bụ  Ayatollah Ruhollah Khomeini,  nyee ntuzi aka 'fatwa' n'isi n'afọ 1989, na-akpo oku  onye hụrụ nwa amadi ahụ, ya gbuo ya bụ nwa amadị a mụnyere n'ezinaụlọ ndị ụka Alakụba. Mana ndị ọkammụta na ndị gụwara isi kwuru na nke a   megidere  ikike dịịrị Rushdie  ikwu uche ya Iran jikwa iwe sị na ha na mba Briten agaghị enwekwa mmekọ ọzọ. Rushdie malitere zọwa isi onwe ya ma na-ebigharị na nzuzo ihe karịrị afọ iri. E nyekwarere ya nchekwa ndị uweojii mana Rushdie , onye ka na-ede akedemede malitere ịpụtawa n'ọha na nsonso a. na-ekwukwa maka ikike  mmadụ nwere ikwu uche ya na enweghị mgbochi ọbụla. Ọ dị ndị na-eme nka mana ụfọdụ ndị nyere ya aka tụgharịa akwụkwọ ya ahụ n'asụsụ ndị ọzọ tụnyere isi ha. Ọ nọ n'ọnọdụ a rute nsonso a ọ malitere pụawa A sugburu Hitoshi Igarashi,  bụ onye tụgharịrị akwụkwọ Satani Verses n' asụsụ Japan na mahadun dị na Tokyo  n;ọnwa Julai afọ 1991. N'otu afọ ahụ, a sụrụ Ettore Capriolo, bụ onye tụgharịrị akwụkwọ ahụ  n'asụsụ Italy mma na Milan mana a zọtara ndụ ya. A gbara William Nygaard, bụ onye Norway egbe n'afọ 1993 na nso ụlọ ya dị n'Ohio mana ọ nwụghị. Ahmed Salman Rushdie bụ onye India a mụrụ na  Bombay nke a ma taa dịka Mumbai n'abalị 19 nke ọnwa Juun afọ  1947, ka ọ gachara ọnwa  abụọ India jiri nwere onwe ha n'aka mba Briten. Ọ gawara mba Briten ka ọ dị afọ 14 bụ  ebe  ọ nọ gawa akwụkwọ Ọ gụrụ 'History; na  'Kings College' dị na  Cambridge. u.was forced into hiding after the publication of his 1988 novel, The Satanic Verses. It took nearly a decade for Rushdie to become more vocal and visible — though he continued to write stories. Today, Rushdie is widely known for being a vocal defender of artistic expression."	https://www.bbc.com/igbo/articles/c2vpdjy05jlo
health	Sweet sweet codeine: Nafdac emechiela ụlọọrụ ọgwụ atọ na-arụ codeine	"Ngalaba na-ahazi nlekọta nri na mmepụta ọgwụ bụ Nafdac n'aha ịchafụ emechiela ụlọrụ ọgwụ atọ; Bioraj Pharmaceutical Limited , Emzor Pharmaceuticals Ind. Ltd na Peace Standard Pharmaceutical Limited bụ ụlọọrụ a rụrụ aka n'ihe gbasara ire ọgwụ ụkwara nwere codeine n'ụzọ megidere iwu. BBC wepụtara akụkọ so nchọpụta nzuzo ha meere nke gbara n'anwụ ka ụlọọrụ atọ a si jiri ụzọ azụ ụlọ na-eresi ọgwụ a nke e mere n'iwu ka a na-ere naani oge dọkịta nyere akwụkwọ, nye ndị ntorobịa agharaaghara. N'akwụkwọ ozi onyeisi Nafdac bụ Mojisola Adeyeye wepụtara, mmechi a sotara nchọpụta ha mere dịka ha gachara n'ụlọọrụ ndị ahụ. ""N'ihi e nwetaghị ihe akaebe zuru oke na mbọ igbochi iwepụta akwụkwọ kwesịrị oge anyị mere nyocha anyị n'ụbọchị 2 nke ọnwa Mee, n'ụlọọrụ ha dị n'Ịlorin na Lagos, ọ dị mkpa ka e mechie ụlọọrụ mmepụta ahịa ụlọọrụ atọ ndị a - Peace Standard Pharmaceutical Limited ; Bioraj Pharmaceutical Limited na Emzor Pharmaceuticals Ind. Ltd .  Nke a bụ iji nye ohere maka nchọpụta zuru oke."" Adeyeye kwukwara na imepe ụlọọrụ ndị a ga-agbado ụkwụ ka ụlọọrụ ndị a si nye Nafac nkwado na nyocha ha. O kwuru na otu Nafdac nke gụnyere ndị ọrụ itoolu; abụọ bụ ndị na-enyocha ọgwụ na asaa bụ ndị nchọpụta n-ahụ maka idewe iwu na ndị uweojii iri gara Ilorin n'ụbọchị ahụ, ị ga mee nyocha ụlọọrụ abụọ e nyere ikike ime ọgwụ ụkwara nwere codeine, ndị a kpọrọ aha n'akụkọ nyocha nke BBC wepụtara. Dika Adeyeye siri kwuo, otu ndị ahụ bụkwa ndị e zigara n'ụlọọrụ Emzor na Lagos. O kwuru: ""Isi ozi e zigara ha bụ ị ga lele akwụkwọ oriri na nkesa ọgwụ ụkwara nwere codeine nye ndị na-aṅụ ya."" O kwuru na Nafdac akpọọla oku nzụkọ ndị ihe gbasara ọgwụ metụtara."	https://www.bbc.com/igbo/44036599
business	Twitter Ban: Otu ọkaiwu akpụpụla gọọmentị Naịjirịa ụlọikpe maka mmachi Twitter	Otu onye ọkaiwu aha ya bụ Inibehe Effiong akpụpụla Lai Mohammed, Abubakar Malami na Gọọmentị etiti  ụlọikpe ukwu dị na Legọs maka ịmachi Twitter. Effiong sị ma mmachị ahụ megidere ikike dịrị onye dịka e dere ya n'iwu Naijiria nke afọ 1999. Effiong gwara ụlọikpe ka o kpebie na ihe Malami na Mohammed sị na a ga-atụ onye daara iwu mmachi Twitter na okwu na-ezighi ezi makana ọ dịghị n'akwụkwọ iwu Naịjirịa. Twitter bụ ngwa ọrụ Ipob ji agbasakarị ozi ha - Lai Mohammed Lai Mohammed bụ Minista na-ahụ mgbasaozi na Naịjrịa akụwarala BBC akụoyibo Nsugbe gbasara mmachị gọọmentị Naijiria machiri Twitter. O kwuru na Twitter bụ ngwaọrụ otu Ipob na otu ndị ọzọ ji agbasakarị ozi ha. O kọwakwara ihe Gọọmentị Etiti bu n'uche n'ozi ahụ ha ziputere bụ nke Twitter wepụrụ. Gee ihe o kwuru n'uju ebe a:	https://www.bbc.com/igbo/egwuregwu-57404198
business	Enugu Water: Gọọmenti Enugwu steeti ahọpọpụtala Martins Okwor dịka onyeisi ọhụrụ ngalaba mmiri	"Aka na achị steeti Enugu bụ Ifeanyị Ugwuamyi ahọpụtala Onyeka Martins Okwor dika onyesisoche ọhụrụ nke ụloorọ na ahụ maka mmiri. Nhọpụta a mere taa bụ ụbọchị itoolu nke ọnwa Maachị. Odeeakwụkwọ gọọmenti Enugu bụ Ọkammụta Simon Uchenna Ortuanya kwuru na nwaamadia bụ onye Ikem dị na okpuruọchịchị IsiUzo dị na steetiu ahụ. O kwukwara na ọ rụọla ọrụ n'ihe gbasara mmiri gafee afọ iri atọ. Cheta na ndị Enugwu bere akwa mmiri kemgbe abalị olenaole gara aga dịka ụkọ mmiri na-anyụ ha anya ebe ahụ. Ndị bi ebe ahụ sị na o ruola nke bụ na nri dị mana mmiri eji esi ya adịghị. Otu onye BBC gbara ajụjụ ọnụ sị na, ""O meela ụbọchị olenaole anyị ji ata ezigbo ahụhụ maka ụkọ mmiri n'Engugwu"". Gọọmeti Enugu steeti ekwuola na ha na-arụgharị ọwa mmiri pọmp n'Enugwu na ọ bụ ya butere ya bụ ụkọ mmiri. Kọmishọna na ahụ maka mmiri na steeti bụ  Dubem Onyia Jr ahụ sị na ọ ga-erucha Ọgọst 2021 tupu o bie."	https://www.bbc.com/igbo/56245386
health	Ọnụọgụgụ ndị ebola na-egbu na Congo ka na-arigo	Akụkọ ndị kachasị mkpa taa: Na Congo, ebola egbuola ihe ruru mmadụ iri ise na ise dịka ndị ọrụ ahụike ha si kwuo, Ebe ihe ruru mmadụ iri anwụọla na mba Italy ka idemmiri buuru ha na mpaghara Calabria. Onyeisiala Muhammadu Buhari mere ihe tụrụ ndị mmadụ n'anya ka o ji ụkwụ gaa ihe ruru kilomita narị asatọ taa. O rituru sonye ndị ji ụkwụ na-aga maka na ndị na-akwado ya nọchichara ụzọ gbochiri ụgbọala ya igafe ka o si ebe ọ gara ekpere maka Sallah na-ala n'ụlọ ya na Daura. Ọganiihu ndị Aba Ndị na-arụ akpụkpọ ụkwu n'ahịa arịarịa dị n'Aba gwara BBC Igbo na ọ bụrụ na e nye ha ohere, na ha ga-arụ akpụkpọ ụkwụ ndị Naịjirịa niile ga na-eyi. Ha kwukwara na ha chọrọ enyemaka gọọmentị inweta ngwaọrụ na ihe ndị ọzọ ha ji arụ ọrụ. David Beckham wụsara akpụkpọ ụkwụ o ji agba bọọlụ n'afọ 2013, ga-enweta nturuugo n'aka otu UEFA. Beckham ga-enweta nturuugo onyeisi UEFA maka onyinye ọ nyere egwuregwu bọọlụ nakwa etu o si akwado bọọlụ n'akụkụ ụwa niile. Gere akụkọ mere na mgbede a n'otu nkeji: Na agbanyeghị nsogbu dị n'etịtị ndị obodo ọzọ dị na Naịjirịa na ndị Fulani na-achi ehi, Akwuke na ndi na-achị ehi na-ebi n'udo.	https://www.bbc.com/igbo/afirika-45264572
entertainment	Lee nwaanyị na-amara Chukwu mbem na ka o si ama ya	"Ify Nweke bụ nwaada Igbo nwere onyinye ịma mbem. Ọ sị na anaghị agara ịma mbem ụlọakwụkwọ na ọ bụ sọ Chi na-enye mbem. Ify si na nwata mawa mbem. Ọ na-akọwa na mbem bụ onyinye nke mmụọ ya ji arịọ Chukwu ihe dị ya mkpa. ""Ọnwebeghị ihe m ji mbe a rịọ Chukwu ọ mebeghịrị m ya"". Ify sị na mgbe ya rịara ọrịa na ọ bụ mbem a ka ya jị chọta ihu Chukwu gwọrọ ya bụ ọrịa. Ọ sị na isi mbem bụ n'egwu ka ọ dị. Ify sị na ọnye onyinye mba mara wepụta ya, ""ezozina ya ezo, ka anyị were ya na-enye Chineke otito"". Mbem bụ ụsoro agụmegwu pụrụiche. Ọ nye na-ama mbe ji okwu agụ egwu. Ihe a ga-eji tụnyere ya na Bekee bụ ""rap music"" nke ọtụtụ ụmụntorobịa na-eme taa. Mbem bụ ọdịnala nka ndị Igbo ja ji eme ihe siri ike. A na-eji mbam eto jike, eji ya akwa arịrị ma ihe ike mee n'obodo. Ejikwa ya akpọkụ olisa dị n'igwe ma ọ dị na mkpa. Onyinye mbem na-ama mmadụ ama, anaghị amụ ya amụ. Ụmụnwoke na-amakarị mbem, mana lekwa nwaanyị a Chukwu nyere onyinye mbem. Igbo bụ ndị na-ekwupụta etu ihe dị ha n'obi. Lee ihe ndị mere mbem jiri dị mkpa n'ala Igbo - Ọ bụ Chigozie Ohaka na Chiemela Mgbeahuru mere akụkọ a"	https://www.bbc.com/igbo/60101099
