politics	Ipob asaala George Obiozor nke Ohanaeze Ndigbo maka okwu ọ gwara Nnamdi Kanu	"Ndị ọkaiwu Ipob gụnyere Aloy Ejimakor na Paul Achalla asaala onyeisi Ohanaeze Ndigbo bụ George Obiozor n'okwu ọ gwara Nnamdi Kanu bụ onye ndu Ipob. Obiozor mgbe ọ na-agwa ndị ntaakụkọ okwu n'Enugwu sị na ""Okwu Biafra karịrị Nnamdi Kanu ikpebi"". Na nzaghachị ndị ọkaiwu Ipob katọọrọ ihe Obiozor kwuru mgbe ha na BBC Igbo nwere mkparịtaụka n'ekwentị. Aloy Ejimakor sị na ọ tụghị anya na Obiozor ga-ekwu ụdị okwu a maka na Nnamdi Kanu abụghị obere nwa, na ọ karịala afọ iri ise. Ọ sị na okwu Biafra abụghị ihe gbasara Ohanaeze Ndigbo maka na ha abụghị otu ndọrọ ndọrọ ọchịchị kama na ọ bụ otu omenala na-ahụ maka ọ dị mma ndị Igbo. Ọ gara n'ihu kwuo na o nweghi ihe Ipob nwere megide onyeisi ọhụrụ Ohanaeze Ndigbo kama na ha ekwesighị ị na-akpụ Ipob na Kanu n'ọnụ mgbe niile. N'okwu nke ya, Paul Achalla sị na Obiozor hapụrụ ihe o kwesịrị ikwu metụtara mmegbu ndị Igbo, mwakpo ndị Fulani na-achị ehi nakwa nchekwa n'ala Igbo ma kwuwe maka Biafra na Ipob. Achalla kwukwara na Nnamdi akwụghị naanị na mbọ inwete Biafra na ọtụtụ ndị Igbo nwere agba so ya n'azụ. Ọ gara n'ihu kwuo na Ohanaeze bụ ọgbakọ ndị ndọrọ ndọrọ ọchịchị si ala Igbo ji ala ezumike nka na ha na anaghị eme ihe ga-abara ndị Igbo uru. Achalla nyere Obiozor ndụmọdụ ka ọ hapụ ịgbaso ụzọ ndọrọ ndọrọ ọchịchị ma lekwasị anya maka ọ dị mma ndị ntoroọbịa, ndị nne nakwa Igbo gbaa gburugburu. Ihe ndị ọzọ Obiozor kwuru:"	https://www.bbc.com/igbo/afirika-55749581
sports	Akụkọ kachasị n'ụtụtụ a: Ronaldo ọgbakeela?	Akụkọ ndị dị mkpa n'ụtụtụ a: A ka na-achọ ndị mụnyere isi ụlọọrụ ndị otu pati APC dị n'Imo steeti ọkụ ụnyaahụ. Hilary Eke bụ onye isioche APC n'Imo na-ekwu na ọ bụ ndị omekome busoro ndị otu ha agha n'izu gara aga, kpara mkpamkpa a. Onyeisiala Muhammadu Buhari kwuru na nlọta ya otu ụbọchị tupu oge o kwuru na ọ ga-alọta abụghị maka ihe ọbụla, na ahụ siri ya ike. Cheta na Buhari kwesịburu ịlọta taa ka ọ gara UK ime nyocha maka ahụike ya. Amachiela onye bụbu Praịm minista ndị Malaysia bụ Najib Razak na nwunye ya ịpụ obodo ha. Ọ kwesịrị ịzara ọnụ ya maka ebubo eboro ya gbasara imefu nde dọla narị asaa oge ọ nọ n'ọchịchị n'afọ 2015. Onye egwu ndị Real Madrid bụ Cristiano Ronaldo alọghachịla ma bido ọzụzụ egwuregwu ọzọ. Cheta na Ronaldo rọjiri ụkwụ ka ha na ndị Barcelona zukọrọ n'ụbọchị ụka mere ka ụfọdụ na-atụ egwu ma ọ ga-agbake tupu ha na Liverpool ezukọọ na ngwụcha Champions League n'ụbọchị iri abụọ na isii nke ọnwa a. Gee nkeji nke ụtụtụ a ebe a:	https://www.bbc.com/igbo/afirika-44092360
religion	L﻿ee ihe Bishop Katọlik Enugu kwuru ga-eme dịka ụka Adoration Ministry na-emepe ọzọ	Ụ﻿lọụka Adoration Ministry Enugu ewepụtala ozi kwuru na ha ga-amalite ịkawa ụka ọzọ n'ụbọchị abụọ nke ọnwa Ọktoba, 2022. Fada Ejike Mbaka bụ onyeisi ụka ahụ, binyere aka na ya bụ ozi e ziputere na Facebook ha. B﻿BC kpọtụrụ Katọlik Dayọsis nke Enugwu steeti, nke Fada Mbaka nọ n'okpuru ya ma bụrụkwa ndị nyere ya mmachi a machiri ha kemgbe ọnwa Juun, 2022. H﻿a gwara BBC na n'ezie, Fada Mbaka ga-aka ụka ahụ n'ụbọchị ha ga-emepegharị ya bụ ụlọụka Adoration. Fada Benjamin Achi bụ ọnụ na-ekwuru Katọlik Dayọsis nke Enugwu steeti,﻿ gakwara n'ihu kwuo na ihe ndị ọzọ ga-eso ya ga-abịazị mgbe a kachara ụka ahụ n'ụbọchị Sọnde. N﻿'ụbọchị 17 nke ọnwa Juun ka Bishop Callistus Onaga, bụ Bishọp Enugwu Katọlik Dayọsis, nyere iwu ka e mechie ụlọụka Adoration Ministry nke Enugwu steeti. N﻿'ozi o ziputere ka ọ na-amachi ụlọụka ahụ, Bishọp kwuru na ha ga-eme nnyocha n'isi Fada Mbaka. O﻿ kwuru sị “N’ihi ọtụtụ ihe ndị na-eme n’Adoration Ministry nke megidere okwukwe na nkuzi ndị Katọlik; a dọọla Fada Mbaka aka na ntị ọtụtụ oge mana o geghi ntị na ntuziaka ndị a. Site n'ikike na ọrụ m dịka onyeisi ọzụzụ atụrụ nke Katọlik Enugwu Dayọsis, amachiela ndị Katọlik (ụkọchukwu, ndị ụka) ịga n’Adoration Ministry efe ofufe ruo mgbe e mechara nnyocha ndị ndu Katọlik na-eme n’isi Fada Mbaka”. C﻿heta na n'afọ 2021, Fada Mbaka jikwa aka ya mechie Adoration Ministry otu ọnwa na Mee, ka ọ gara ikpe ekpere otu ọnwa. N﻿ke a mere dịka ọ rịọchara Bishọp Onaga mgbaghara maka ngagharịiwe nke ndị ụka ya mere nke butere ọgbaghara na mmebi ngwongwo ndị ụka. Fr Ejike Camillus Mbaka bụ ụkọchukwu Katọlik na-arụ ọrụ na Dayọsis nke Enugwu, na mpaghara Ọwụwa Anyanwụ Naịjirịa. Ọ bụkwaya ya bụ onyeisi ụlọ ekpere a na-akpọ 'Adoration Ministry Enugwu, Nigeria' (AMEN). E chiri ya ụkọchukwu n'ọnwa Julaị nke afọ 1995, nke pụtara na ọ rụọla ọrụ dịka ụkọchukwu ihe ruru afọ 27 ugbua. Otu ihe e ji mara Mbaka bụ na ọ na-ebukarị amụma gbasara ndọrọndọrọ ọchịchị, ntuliaka, nakwa ndị ga-emeri ntuliaka.	https://www.bbc.com/igbo/articles/cjrnjzjnrxxo
politics	Abia state politics: Ihe mere m ji wụpụ n'APGA nakwa pati m ga-abanye - Alex Otti	Alex Otti zọbụrụ ọkwa gọvanọ n'Abia steeti gwara BBC Igbo ihe mere o ji si na pati All Progressives Grand Alliance (APGA) ọ nọbụ na ya pụọ. O kwuru na mgbe oge ruru na ọ ga-agwa ụwa niile patị ọzọ ọ na-aga. Gere ya n'uju n'ihe nkiri a.	https://www.bbc.com/igbo/afirika-53042311
sports	Man City nọ n'ụlọ buru iko Premia Lig	Akụkọ ndị kachasị mkpa mere taa n'ichafu: Man City tukwu n'ụlọ merie Premia Lig Newcastle meriri Arsenal n'asọmpi ya taa N'egwuregwu, Newcastle ji ọkpụ goolu abuo asatara otu (2-1) wee merie Arsenal n'asompi a gbara taa. Arsenal bu uzo nye goolu tupu Newcastle asaa ya, were nyekwa nke ha jiri nweta mmeri na ya bụ asọmpi. Ndị agha oshimiri mba Ghana jidere ụgbọmmiri mmanụ agbịdị ndị Naịjirịa Ndị agha oshimiri mba Ghana akparala ụgbọmmiri ahịaiwu mmanụ agbịdị ndị Naịjiria. Ụgbọmiri ahụ bu mmadụ iri na otu (11) ma burukwa mmanụ ruru metrik tọn narị atọ na iri abụọ (320). Akụkọ ndị ga-amasị gị: Ndị Edo Steeti anwụchiela ndị ọchịehi Aka na-achị steeti Edo bụ Godwin Obaseki, anwụchiela ndị ọchịehị n'obodo abuo na steeti ahụ. Obaseki hibere komitii gbata gbata ga-enyopu ebe ndị ochịehi n'ime ọhia ma kpụgara ha ndị uweojii. Na mba ofesi Onye nnọchite anya US n'ọgbakọ otu mba uwa bụ UN bụ Nikki Haley, ekwuola na mba ha agaghị esi na Syria pụta ma ebum n'obi ha emezughị. Ime ka Syria kwụsi iji ngwọagha kemikal gbuo ndị be ha so n'ihe Nikki Haley kwuru bụ ebumnobi ndị US. Nkeji nke mgbede a Gere akụkọ ndị a n'otu nkeji. Ihe nkịrị nke taa Ihe onyonyo a gosiri ụmụ Igbo na-agba mbọ na Ladipo, Legos.	https://www.bbc.com/igbo/afirika-43770026
health	No Bra Day: Gini ka ụbọchị a pụtara?	"Dịka ọ na-ewu n'ebe niile, ọtụtu ndị mmadu nwere nghọtaghịe ihe ụbọchị a bụ maka ya. Etu ụbọchị a siri Bido Dịka ndị otu Cancer.ca siri kọwaa, ọ bụ  Dọkinta Mitchell Brown bịdoro ụbochị a i ji mepee anya ndị mmadụ maka ihe gbasara ọrịa kansa n'afọ 2011. Brown kpọrọ ya 'BRA Day' nke pụtara ""Breast Reconstruction Awareness Day"". #NoBraDay: Ọ ga-akwụsị ọrịa kansa n'ụmụnwanyị? Ebum n'obi Brown bụ ị kụziri ụmụnwaanyị ndị a ga-awa ara maka ọrịa kansa na ha nwere ikike ị sị ka awa ha ara ma meekwa ya ka ọ dị mma . Nke a ka ndị Bekee na-akpọ 'Reconstructive Surgery'. Afọ atọ ka ọ were ka emume a gazụọ mba iri atọ. Ka oge na-aga ka atụghaghịrị aha ụbọchị a site na BRA DAY ọ bụrụzia No BRA Day, nke mere ka ọtụtu ndị mmadụ aghọtaghe ya. Ọ na eme Nwoke na Nwanyị kama ọkacha eme ụmụnwanyị ebe ihe pekarịrị 1% n'ime ụmụnwaoke (Dika Nna Beyounce Knowles bụ Mathew Knowles) otu narị na-enweta ya. Otu ihe ikwesiri ime i jị gbochie Kansa Ara Enwere ụzọ abụo esi achọpụta ma mmadụ enwere Kansa ara. 2. Nke abụọ bụ ịga ụlọ ọgwụ ka ha nyocha ara gị Nwaada a na-akọwa na ọ bụ ụbọchị maka Kansa Ara na ọ bụghị maka ịgba ọtọ Nwaada a na-egosi ụmụnwanyị etu ha ga-esi nyocha onwe ha maka kansa ara."	https://www.bbc.com/igbo/afirika-50032212
politics	Mbazulike Amechi: Ọ bụrụ na ndị ọbụla eketeghi oke ha na Naịjirịa ọ ga-ekewa	Mbazulike Amechi bụ otu onye so gbaa mbọ maka nnwereonwe Naịjirịa ebe afọ 1960 etinyela ọnụ n'ihe gbasara ọchịchọ Biafra. O kwuru sị na otu Indigenous People of Biafra (Ipob) bụ ndị na-achọ nnwereonwe Biafra selitere isi ugbua n'ihi iwe maka etu ha si hụ obodo Naịjirịa. Ma kwuo na ebe ihe masịrị ha bụ ka ha nọrọ ma chịa onwe ha, na ọ ga-adị mma ka a tụọ vootu mara ma ha a ga-apụ na Naịjirịa maọbụ ha a ga-anọ. Amechi kwuru sị na agaghịzị eji ọgụ na mma lụọ agha Biafra, kama na ọ bụzị akọnauche ka a ga-ejizi alụ ya. Ọ gara n'ihu kwuo sị na ọ bụrụ na agaghị eme ndị Igbo ka e mere ibe ha na Naịjiria, na ọ ga-aka mma ka a hapụ ndị Igbo ka ha gawara onwe ha, n'agbanyeghi na ọ gaghị amasị ya ka Naịjiria kewaa. Ndị mere akụkọ a bụ Ebere Ekeopara na Nnamdi Agbanelo	https://www.bbc.com/igbo/afirika-54170218
politics	Inec Anambra Governorship List 2021: Lee kpọmkwem ndị niile INEC kwuru ga-eso zọọ ọkwa gọvanọ Anambra steeti	"Ngalaba na-ahazị ntuliaka na Naịjiria bụ 'Independent National Electoral Commission' eweputela aha mmadụ iri na asatọ ga-eso zọọ ọkwa gọvanọ Anambra steeti. Cheta na ọ bụ n'abalị isii nke ọnwa Nọvemba ka ntuliaka a ga-adị. INEC wepụtara aha ndị a na mgbede taa bụ Tọzde, abalị asaa nke ọnwa Ọkụtoba. Ka ọ dị ugbua, ọ fọla naanị abali iri atọ na isii tupu ụbọchị ya bụ ntuliaka eruo. Lee aha ndị ha wepụtara nakwa otu ndọrọndọrọ ọchịchị ha nọ na ya: Ngalaba 'Independent National Electoral Commission' ewepụtela aha ndị ga-eso zọọ ọkwa Gọvanọ n'Anambra Steeti. Mana ihe gbara gharịị bụ na aha Chukwuma Soludo nakwa nke Valentine Ozigbo adịghị n'akwụkwọ nke Inec wepụtara. Chukwuma Soludo bụ onye meriri ntuliaka imeụlọ nke pati APGA, ebe Valentine Ozigbo meriri nke PDP Ọ bụ n'ehihie Fraịde ka Inec wepụtara akwụkwọ aha ndị ga-eso zọọ ọchịchị n'Anambra steeti. N'ime akwụkwọ ahụ, aha mmadụ iri atọ na isii dị n'ime ya, nke gụnyere mmadụ iri na asatọ na-azọ ọkwa gọvanọ nakwa mmadụ iri na asatọ bụ osote ha. A bịa na pati APC, onye aha ya dị ebe ahụ bụ Emmanuel Andy Nnamdi Uba, ebe osote ya bụ Johnbosco Okechukwu Anaedobe. Mana na Pati APGA, onye aha ya dị ebe ahụ bụ Chukwuma Michael Umeoji, ebe osote ya bụ Orogbu Obiageli Lilian. Na nke PDP, onweghị aha ọbụla e dere ebe aụ, kama ihe Inec dere bụ ""court order"". Na YPP, onye aha ya dị ebe ahụ bụ Ifeanyi Uba, ebe osote ya Aloysius Izuchukwu Ekee. Cheta na ndị PDP n'Anambra steeti kewara ụzọ abụọ n'ihi na ha na-azọ onye ga-abụ onyeisioche. Mmadụ abụọ na-azọ ya bụ okwa nwechara akwụkwọ si n'ụlọikpe nke na-ekwu na ọ bụ ha bụ onyeisi n'otu n'otu. Nke a mere ka ndị isi PDP n'Abujakposaa ọchịchị PDP nke Anambra, ọ ga-enye ha nsogbu na ntuliaka 'Primary' ha?ma jiri aka ha họpụta ndị ga-ahazi ntulaiaka imeụlọ na steeti ahụ. Mana nke a mere ka otu PDP abụọ ahụ nọ n'Anambra mee ntuliaka imeụlọ icheiche, ma họpụta ndị ha kwuru meriri. Otu nke mbụ họpụtara Valentine Ozigbo, ebe otu nke abụọ họpụtara Ugochukwu Uba. Mana ugbua, Inec ekwuola na onweghị onye n'ime mmadụ abụọ a ha kwenyere na ya, n'ihi na ya bụ okwu ka dịn'ụlọikpe. N'otu aka ahụ kwa, pati APGA kewakwara ụzọ abụọ n'Anambra steeti n'ihi esemokwu imeụlọ. Mmadụ abụọ na-azọ ọkwa onyeisi oche na pati ahụ: ha bụ Victor Ike Oye na Jude Okeke. Chukwuma Soludo nọ n'otu nke Victor Oye ebe Chukwuma Uneoji - onye nke Inec nabatara - nọ n'otu nke Jude Okeke. BBC Igbo kpọtụụrụ Chukwuma Soludo mana o kwuru na ya achọbeghị ikwu ihe ọbụla ugbua. Nsogbu malitere n'APGA n'afọ 2016 oge ụfọdụ ndị otu ahụ kwuru na ha achọzighị Victor Oye dịka onyeisi ha. Ndị a gara n'ihu họpụta nwoke a kpọrọ Nwabueze Okafor ka ọ bụrụ onyeisi ha. Mana o teghị aka, Okafor anwụọ; ha wee họpụta Martin Agbaso ka ọ nọchie anya ya. Kamgbe ahụ, okwu onye bụ onyeisioche APGA n'Anambra steeti akọbeghị ụkọ n'ụlọ ikpe. Bido na 2016 ruo taa, Ndị kwurula na ha bụ ndị isi APGA gụnyere: Victor Oye, Martin Agbaso, Edozie Njoku, na Jude Okeke. Mana dịka o si dị ugbua, INEC egosila na ọ bụ Jude Okeke ka ha ma dịka onyeisi Apga."	https://www.bbc.com/igbo/afirika-57842787
entertainment	Maternal Mortality: Uche Jombo na ụmụnwaanyị ndị ọzọ kwuru ihe mere ha agaghị amụju ụlọ	"Ụfọdụ ndị ọkachamara na-eche na ịkwụsị atụmaatụ ebe ụmụnwaanyị na-achọrịrị ka ha mụta nwa nwoke nwereike belata ụmụnwaanyị ịnwụ ebe ha na-amụ nwa. Uche Jombo kwuru na ọ dịghị ka ụmụnwaanyị na-achịpụta ụmụ iri na abụọ maọbụ itoolu dịka nne ya si mee. Jombo kwuru na ịmụta nwa na-ara ya ahụ; na afọ ime ya pụrụ ugboro atọ. Ibukun Ogu ji ụmụ atọ kwuru na o bu ụzọ mụta ụmụnwaanyị abuọ tupu ọ mụta otu nwoke mezuru ha ụmụ atọ. Mana o kwuru na ya na di ya kwetara ịmụta ụmụ abụọ sọsọ mgbe ha lụchara di na nwunye. Otu nwaanyị na-achọghị ka a mata aha ya kwuru na ya mụrụ ụmụ anọ ebe ọ na-achọ ịmụta nwa nwaanyị. O kwuru na o ji ịwa afọ mụọ ha niile nke mere ka di ya were ụjọ sị ya amụzịla ka ọ mụchara nke atọ bụkwa nwoke, mana o siri ọnwụ mụọ nke anọ mechara bụrụ nwa nwaanyị ọ na-achọ kamgbe. Ihembosi dị afọ iri atọ na asaa mụrụ nke mbụ, ọ bụrụ nwoke, nke abụọ so ya bụrụ ejima nwoke abụọ, nke anọ abụrụzịa nwaanyị ọ na-achọ. Mana otu nwaanyị ahụ mechara nwụọ. Kedụ ihe mere ụfọdụ ụmụnwaanyị ji achọkarị ka hamụtarịrị nwoke maọbụ nwaanyị? N'agbanyeghị ihe ọdachi na-adakwasị ụmụnwaanyị na-agba mbọ ịmụta nwoke maọbụ nwaanyị mgbe ụfọdụ, ọtụtụ achọghị ikwụsị ya bụ atụmatụ. Ihe mere Chinenye ji ụmụnwoke atọ ji chọọ ịmụtarịrị nwa nwaaanyị Gịnị mere e ji achọkarị nwa nwoke? Chinedu Balogun kwuru na otu n'ime ha bụ oke ịcha ọkụ ụmụ ụwa na-enye di na nwunye. Ihe ndị ọzọ e ji achọ nwa nwoke gụnyere: Ngalaba European Union na United Nations a kpọrọ ""Spotlight Initiative"" na-ekwu na atụmatụ ịmụtarịrị nwa nwoke ebutela mmegide dị iche iche nye ọtụtụ ụmụnwaanyị na Naịjirịa. Ihe nkiri a ga-amasị gị:"	https://www.bbc.com/igbo/afirika-50950623
religion	'Ọ bụ okwu mmekọ nwoke na nwoke n'etiti ndị ụkọchukwu butere esemokwu n'ụlọụka Anglịkan dị n'Ezinifite'	"Dịka ọtụtụ mmadụ ka na-ajụ ihe kpatara ndị Ezinifite jiri gbachie ụlọụka Immanuel dị na be ha ụbọchị ụka, ọnụ na-ekwuru Dayosis Anglican nke Aguata agwala BBC ebe mmiri siri banye n'akụ oyibo. Abụchị Nwozor sị na okwu ahụ malitere kemgbe afọ 2017 oge Dayosis ahụ mechara nnyocha were chụọ ụfọdụ ụkọchụkwu ""makana ha na-edina nwoke ibe ha."" ""Ihe meziri bụ na Ụkọchukwu na-ahụ maka Ezinifite, bụ Venerable Emma Ekejiuba, gara ebe a na-akwa ozu were kwuo na otu n'ime ndị a achụrụ enweghị ihe o mere were kpụọ ya ka o soro ya kpee ekpere."" Ọ sị na agwa Ụkọchukwu Ekejiuba kpara site ịkpọghachi onye achụrụ n'ọrụ ụkọchukwu ma kwuo na onweghi ih e o mere megidere iwu ndị Anglican na Naịjirịa. Maazị Nwozor gakwara n'ihu kwuo na aka Bishop Aguata bụ Samuel Ezeofor adịghị n'ihe mere karịcha na ọ bụ ya nyere Ven Ekejiuba ezumike nwagbenta. Ọ sị, dịka Bishop Ezeofor nụrụ ihe Ven Ekejiuba mere, ọ hibere kọmịtị maka nyocha ka a mata nke bụ eziokwu, mana ọ gọrọ. Ka emechara, a chọpụtara nọ ọ bụ eziokwu makana ihe o kwuru dị na ""tape"". Maazị Nwofor gakwara n'ihu kwuo na ya bụ obodo adaala jii dịka ụfọdụ ndị so mee nsogbu ụbọchị ụka na abịa ịrịọ mgbaghara. Ihe a Maazị Nwozor kwuru dabanyere n'ihe otu ụkọchukwu na-achọghị ka a kpọọ aha ya gwara BBC n'ụbọchị Sọnde bụ ihe mere ndị ntoroọbịa Ezinifite ji were igodo gbachie ụlọụka Immanuel dị n'obodo ha. BBC kpọrọ Ụkọchukwu Ekejiuba ka anụta ọnụ ya o were sị ka akpọghachi ya. Mana oge eji kpọghachi ya, ekwentị ya anaghịzị aga. Kedụ ihe mere e ji kwụsị Archdeacon a ọrụ? Ụkọchukwu a sị na e nwere otu ụkọchukwu bụ nwafọ Ezinifite a chụrụ maka ebubo mmekọrịta nwoke na nwoke n'afọ ole na ole gara aga. Onye Archdeacon a gara akwamozu ma hụụ ụkọchukwu a, sị ya kpee ekpere gọzịe nri n'akwamozu ahụ. Mana iwu ndị ụka Anglican megidere onye ụkọchukwu a chụrụ achụ ịrụ ọrụ n'ụdị ọbụla, nke mere mgbe ozi ruru Bishọp ntị na ọ gbarụrụ ihu. Bishọp gara n'ihu kwụsịtụ Archdeacon a ọrụ n'ihi agwa ọ kpara ma zigaa onye ọzọ n'Ezinifite ka ọ nọchite anya ya na nchere oge. Ụfọdụ ndị ntoroọbịa Ezinifite anabataghị ya nke mere ha ji gbachie ụlọụka sị ka a kpọchịrị ha Archdeacon a kwụsịtụrụ ọrụ. BBC Igbo kpọrọ Bishop Samuel Ezeofor n'ekwentị ka a mata etu eke si anya anwụ maka ọ zabeghi rute ugbua akụkọ na-apụta. Cheta na ihe onyonyo na-efegharịnụ na soshal midia gosiri ka ndị ụlọụka Emmanuel Anglican Church Ezinifite dị n'Anambra steeti na-eme ngagharịiwe. O gosiri ebe ọtụtụ mmadụ kwụ n'ọnụ ụzọ ụlọụka ahụ na-ekwusike na ha achọghị ka archdeaconry ọhụrụ ewetere ha bata n'ụlọụka ha kama ka ewetere ha nke ochie ka pụchara tupu nke ọhụrụ a abata. Nke a mere ka ha were akwụkwọ e dere ""Uzọ anyị mechiri emechi"" madocha n'ọnụ ụzọ ụlọụka ahụ ka aghara ịka ụka taa ebe ahụ."	https://www.bbc.com/igbo/afirika-54049830
health	Butt Implant: 'Achọrọ m ịwepụ otele m gotere egote'	"Sophie Elise bụ nwaagbọghọ dị afọ iri abụọ na anọ nwere agba n'ihe onyonyo na Norway ma nwee ndị nkwado puku narị ise n'elu 'Instagram'. Sophie kọwara na o nwere obere ahụ mana ọ chọro ka e wulite ukwu ya ka ọ dị ka nke 'nwaanyị Owere'. Dịka ọtụtụ ndị mmadụ na-agbasa iwulite otele dị ka ngwaahịa n'Instagram, Sophie graa mba Tọki ịzụta otele nke ya. O kwuru na ọ na-atụ anya na ọ ga-ada ezigbote ọnụ, mana ha beere ya ezigbo ego nke mere ka obi dị ya mma. ""O bere ego oo, o bere ego karịa ihe ọ kwesịrị ibụ"" ka Sophie gwara ndị mgbasa ozi 'Radio 1 Newsbeat' O kwuru na mgbe a wachara ya otele, na ahụ fụrụ ya ụfụ. Mgbe na-adịghị anya, ndị mmadụ na Soshal Midịa bidoro kwuwe okwu maka otele ya. Ndị mmadụ kwuru na otele ọhụrụ ahụ na ahụ ya agakọghị nke ọma. ""Ugbua ka m matara na ọ bụghị ihe m kwesịrị ime. Ihe niile mere m 'vuum' n'anya, ugbua ka m matara na m echeghị ya ọfụma tupu m waa otele m"" ka Sophie kwuru. Sophie tinyere nke a na-etinye etinye akpọro 'Silicone' mana e nwere atụmatụ ọzọ ebe a ga-ewere abụba dị n'ahụ mmadụ were tinye n'otele ka o buo ibu. Ọ chọpụtala na ahụ ya mara mma ma ghọta na onweghị ihe o ji. Mana ịwepụ otele ya ugbua nwere 'Kọma' Sophie mechazịrị chọta onye dọkita na-awa ahụ nke ọma. Dọkita a kọwaara ya na o nweghị ike ịwepụcha ha niile n'ihi na nke e tinyeere ya bụ nke a na-etinye n'ara. Ọ gwara Sophie na ihe ga-emebi ma e wepụchaa ha niile n'ike. Sophie kwuru na ọ ga-arụzi otele ya n'ọdịnihu, mana ka ọ dị ugbua, ọ ga-ewelata ya ka ọ dịkwa ka ihe yiri anụ ahụ mmadụ. Akụkọ ga-amasị gị: Ihe nkịrị ga-amasị gị:"	https://www.bbc.com/igbo/afirika-50186048
sports	Iker Casillas bụbụ oche goolu Real madrid awụsala ọwa n'afọ 39	"Iker Casilas awụsala ọwa n'egwu bọọlụ n'afọ iri atọ na itoolu. O cherela Real Madrid goolu ugboro narị asaa na iri abụọ na ise (725) n'ime afọ iri na isii (16) ya na ha nọ na Santiago Bernabeu. O ritere iko Champions League ruru atọ na nke La Liga ruru ise. O nyere mba Spain aka rite iko mba ụwa nke 2010 nakwa ""European Championships"" ugboro abụọ n'afọ 2008 nakwa 2012. Casillas sonyere egwu bọọlụ Porto n'afọ 2015 mana ọ gbabeghị bọọlụ kamgbe April nke afọ 2019 maka nkoropu obi mere ya mgbe ọ na-eme ọzụzụ. Mgbe ọ na-agbake, e nyere ya ọkwa n'ogo ndị nchịkọta otu bọọlụ ahụ na Julai nke afọ 2019. Casillas agbarala ndị Porto bọọlụ ugboro 156 , merie ọkwa Primeira Liga  ugboro abụọ nakwa iko Portuguese. O gbara ndị mba Spain bọọlụ ugboro 167 site na 2000 ruo afọ 2016.  Sergio Ramos bu onye ọgba bọọlụ ibe ya na Spain ka ya gbara mba ahụ bọọlụ ugboro ugboro. O depụtara nwụsa ọwa ya na twitter ma si ihe kacha mkpa n'ụwa bụ njem ị gara na ndị so gị wee mee ya na abụghị ebe njem ahụ dụgara gị. Real Madrid bụ otu egwuregwu e ji mara Casillas kwuru na o sonyere ha mgbe ọ dị afọ itoolu ma bụrụkwa ọkaibe na oche goolu ha kamgbe afọ 118 otu egwuregwu ahụ malitere. Onye otu ya na Real Madrid bụ Sergio Ramos wepụtara ya na Casillas sere n'elu twitter iji we kele ọyị ya. N'ọnwa February, ka o gosiri mmasị ya ịzọ ọkwa onyeisioche Spanish Football Federation (RFEF) mana o mechara sere isi ya maka nsogbu Covid-19 butere na mba ahụ."	https://www.bbc.com/igbo/afirika-53653780
health	Lock Down in Nigeria: Gbanahụ oke ibu, 'afọ beer' site n'iri nri ndị a n'oge a	"Ị na-atụ ụjọ ibu oke ibu maọbụ inwe 'afọ beer' n'ihi ọnọdụ nọrọ n'ụlọ nke gọọmenti manyere onye ọbụla ruo? Nwanne bute oche ka ị gụọ ihe nwada Igbo a bụ ọkammụta gbasara nrị na ihe o na-enye n'ahụ kpọpụtara dịka nri ị nwereike iri wee gbanahụ ọrịa ịnọ otu ebe na-ebute Nọọsụ Adanna Monday kwuru na ugbua ohere ịnọ n'ụlọ dapụtara,  ọ dị mkpa ka onye ọbụla jiri aka ya na-esi nri ya ugbua. O kwukwara na mmadụ kwesiri ị na-ahazị oke nri ọ na-eri kwa mgbe. N'okwu ya, ""iri ezigbo nri ga-eme ka ọrịa dịka oke ibu, ọbara mgbali elu, diabetes, gbaara mmadụ ọsọ."" 1. Mkpụrụ osisi Nọọsụ Adanna kwuru na irikarị mkpụrụ osisi ga-eme ka ọrịa ịnọ otu gbalaga. Ụfọdụ mkpuru osisi ọ gụputara gụnyere orọma, 'lemon', 'strawberry', na mango bu ezigbo vitamin C ebe water melon ga-enye gị ezigbo mmiri n'ahụ. Apple bụkwa mkpụrụosisi ga-enye gị nnukwu ""Fibre"" ga-edozi ahụ gị. Riwe ụgụ na spinach ọfụma maka na 'green' ha tọrọ atọ dịka dọkịta Adanna si kwuo. Nke a ga-enye gị ihe ndị nwereike iluso nje agha n'ahụ gị. Ọ na-abụ ịhụ anụ ehi ahụ a na-ama gị jiji? Biko ọ bụghị maka oge a. Nọọsụ Adanna kwuru na anụ dịka azụ ọcha(crocker maọbụ tilapia), anụ ọkụkọ maọbụ anụ 'turkey' na ka mma n'oge a maka ịgbanahụ ọrịa. Nke a ga-eme ka ahụ gị ghara ị na-anyị gị arụ mgbe niile. 4. Kabọhidreti pụrụ iche Dọkịta Adanna gụpụtara nri a dịka osikapa ọfada , osikapa nke si n'ubi ghara ịgabiga ọtụtụ mgbanwe. Ọ gụnyere beans, potato na legume niile makana ha ga-eme ka ịghara ị na-ata cham cham. Nri ndị a bụ nọtụ, salmon, olive oil, Mackerel na ube oyibo. O kwuru na nri ndị a na-edozi obi mmadụ mana ọ ga-adị mma ka mmadụ ghara iribi ga ya oke maka ibu, tụmadị ọ bụrụ na ị na-agbara ibu ọsọ. Nke a bụ makana ha bu ibu karịa protein na kabọhidret. N'ikpeazu, dọkịta Adanna kwuru ka ndị mmadụ na-aṅụ mmiri ọfụma n'oge a. Ọ bụrụ na o kweghị gị, gote mkpuru osisi juputere na mmiri dịka 'water melon' tawa."	https://www.bbc.com/igbo/afirika-52165477
health	Coronavirus: Ihe mere m ji asachasị ebe a na-agwọ ndị bu coronavirus	Damoah Asareh nwafọ mba Gana na-arụ n'ụlọọgwụ ebe a na-elekọta ndị bu coronavirua akọwala ihe ọ na-agabiga n'ọrụ ya. Ọ sị na ọ na-eme nke a iji nyere ndị a aka. Ọ kwuru na ọ bụ eziokwu na ụjọ na-atụ ya n'ọrụ a mana ndị a bụ mmadụ ibe ya. Na ọ bụrụ na ọ bịaghị, na onye ga-enyere ndị a aka? Asareh sị na nke ọzọ bụ na ọ hụrụ ọrụ ya n'anya. Akụkọ ndị ga-amasị gị:	https://www.bbc.com/igbo/afirika-52987470
